comments,parameter,display_name,value_type,description,default_value,examples,valid_min,valid_max,valid_options,required,regex,popular,automl_enabled,math_cond,parent_param,depends_on
,inference_config.batch_size,Batch Size,integer,The batch size for inference,1,,1,inf,,,,,FALSE,,,
,inference_config.rpn_pre_nms_top_N,RPN Pre-NMS Top N,integer,The number of boxes (ROIs) to be retained before the NMS in Proposal layer during inference,6000,,1,inf,,,,,FALSE,,,
,inference_config.rpn_nms_max_boxes,RPN NMS Max Boxes,integer,The maximum number of boxes (ROIs) to be retained after the NMS in Proposal layer,300,,1,inf,,,,,FALSE,,,
,inference_config.rpn_nms_overlap_threshold,RPN NMS IoU Threshold,float,The IoU threshold for NMS in Proposal layer,0.7,,0,1,,,,,FALSE,,,
,inference_config.bbox_visualize_threshold,Visualization Threshold,float,The confidence threshold for visualizing the bounding boxes,0.6,,0,1,,,,,FALSE,,,
,inference_config.object_confidence_thres,Object Confidence Threshold,float,The objects confidence threshold,0.00001,,0,1,,,,,FALSE,,,
,inference_config.classifier_nms_max_boxes,Classifier NMS Max Boxes,integer,The maxinum numbere of boxes for RCNN NMS,100,,1,inf,,,,,FALSE,,,
,inference_config.classifier_nms_overlap_threshold,Classifier NMS Overlap Threshold,float,The NMS overlap threshold in RCNN,0.3,,0,1,,,,,FALSE,,,
,inference_config.detection_image_output_dir,Image Output Directory,string,Path to the directory to save the output images during inference,,,,,,,,,FALSE,,,
,inference_config.bbox_caption_on,Bbox Caption,bool,Enable text caption for bounding box or not,,,,,,,,,FALSE,,,
,inference_config.labels_dump_dir,Labels Ouptut Directory,hidden,Path to the directory to save the output labels,,,,,,,,,FALSE,,,
,inference_config.nms_score_bits,NMS Score Bits,integer,Number of score bits in optimized NMS,,,1,10,,,,,FALSE,,,
,inference_config.trt_inference,TensorRT Inference,Collection,TensorRT inference configurations,,,,,,,,,FALSE,,,
,inference_config.trt_inference.trt_engine,TensorRT Engine,hidden,Path to the TensorRT engine to run inference,,,,,,,,,FALSE,,,